ひらがな,単語,英語,ジャンル,関連,出題,ソース,重要度,文字数,説明
ちゅういのまたたき,注意の瞬き,attention blink,認知心理学,プライミング,2018,なし,3,43,？ある対象に注意を向け反応が向上した直後に、一時的に対象への反応が低下する現象のこと。
がくしゅうせいむりょくかん,学習性無力感,Learned helplessness,発達心理学,うつ病　オペラント条件づけ,2018,マイヤーズ,3,299,反復性の有害な出来事を避けることができない場合に、無力感と受動的な諦めを動物や人間が学習すること。セリグマンの実験(1975、1991)では、固定用ベルトでくくりつけられた犬に電気ショックを反復呈示し、回避が不可能な状態にしたところ、犬は無力感を学習し、その後別の状況で罰の回避が可能であっても希望がないかのようにうずくまるという結果が得られた。同様に人間も自分でコントロールできない外傷体験に何度も遭遇したとき、人は無力感や絶望感、抑うつを感じるようになる。自分の知らない文化で感じるカルチャーショックはコントロール感の低下にあることが示唆されている。うつ病の自滅的信念への影響も示唆されている。
ぶろーかや,ブローカ野,broca area,脳神経科学,ウェルニッケ野　言語,2018,マイヤーズ,3,191,前頭葉の一部であり、ほとんどの場合左半球にあり発話に関与する筋活動に関与するとされる領野である。フランス人の医師ポール・ブローカはこの部位の損傷により話し言葉の発話が困難になることを報告した。この発話の障害はブローカ失語と呼ばれ、なじみの歌を歌ったり話し言葉は理解したりはできるものの、発話は助詞や動詞のないものとなり、言葉を話したての幼児のような発話と喩えられるようなものである。
ちかくてきじゅうてん,知覚的充填,Filling in,知覚心理学,盲点,2018,なし,3,126,？感覚器官から入力された情報に欠落した部分がある場合、それを補填する脳の働きのこと。視覚で言えば盲点の充填がその例として挙げられ、光信号の受容体がない盲点の部分の情報を周囲の情報から推定し充填することで、意識に上る際には欠落のない映像として知覚される。
せいしまくでんい,静止膜電位,resting membrane potential,神経科学,ニューロン,2018,ネット,3,307,細胞膜がイオンを通さないことによってイオンが一定の濃度に保たれている中、イオンチャネルによるイオンの透過性と膜内外のイオンの濃度差によって生じる平衡電位のこと。細胞膜には刺激がなくても常時開いたままの漏洩カリウムチャネルが存在し、内部の方がカリウムイオン濃度が高いためにカリウムイオンを常に細胞外に流出させ続けており、濃度勾配による流出とそれによって生じる電気勾配の釣り合いによって平衡電位が生じる。その大きさは約70mVで、他のイオンの濃度の影響もあるがネルンストの式でカリウムイオンの平衡電位を求めると近い値が得られる。興奮性細胞の場合、ナトリウムチャネルへの刺激によって急激な電位変化である活動電位が生じる。
ちゅうおうじっこうけい,中央実行系,central executive,記憶心理学,ワーキングメモリ,2018,ネット,3,111,Baddeley & Hitchの提唱したワーキングメモリーモデルにおける中心的な構成概念であり、下位システムの記憶貯蔵庫（視空間スケッチパッド・音韻ループ）と相互作用して、それらの制御と情報処理を行う認知システムである。
りようかのうせいひゅーりすてぃっく,利用可能性ヒューリスティック,availavility,社会心理学,意思決定　バイアス,2018,マイヤーズ,3,297,トヴェルスキーとカーネマンの提唱したヒューリスティックスの一つで、出来事の起こりやすさを見積もる際に、記憶の中でそれがどれくらい利用可能かに基づいて決めること。事案がたやすく心に浮かぶものであればそうした事象が現実に起こりやすいものと仮定する。少ない情報と時間である程度正確な意思決定を行うための経験則であるヒューリスティックであるが、「自殺と殺人どちらが多い？」「Kで始まる単語とKが3番目の単語どちらが多い？」というような問いでは誤りやすくなる。確率という属性をその利用可能性という属性に代替すること、利用可能性という評価しやすい対象に代替することにヒューリスティックの特性があるとされる。
めいしんこうどう,迷信行動,superstitious behavior,行動主義,オペラント条件づけ,2018,ネット,3,34,？偶然生じた行動が強化される事でその行動頻度が増していく行動のこと。
まぐにちゅーどすいていほう,マグニチュード推定法,,認知心理学,閾値　心理学史,2018,ネット,3,45,？基準になる刺激の強さを「10」として、次に提示される刺激を数値で答えてもらう方法です。 
あいこにっくめもりー,アイコニックメモリー,iconic memory,記憶心理学,感覚記憶,,マイヤーズ,2,276,視覚刺激についてのごく一瞬の感覚記憶のこと。0.1秒から0.2秒程度の間だけ、目に写った画像の写真的、絵画的な記憶が心に留まり、そのどの部分に関しても細部まで思い出せるというもの。1960年のジョージ・スパーリングの実験では、9文字を瞬間提示したすぐ後に3段階の高さの音のどれかを鳴らして1行目、2行目、3行目のどの行を報告するかを指示したところ、どの行についても答えることができたということが示されている。しかし、この時間感覚を0.5秒以上遅らせると半数くらいの文字しか残らないという結果となった。聴覚刺激の感覚記憶はエコイック・メモリーと呼ばれる。
あいぜんくじんかくしつもんし,アイゼンク人格質問紙,Eysenck Personality Questionaire,性格心理学,外向性,,マイヤーズ,1,227,イギリスの心理学者であるハンス・アイゼンクとシビル・アイゼンクにより提唱された、人間の正常範囲の個人差の多くは因子分析によって外向性ー内向性、情緒安定性ー情緒不安定性といった2〜3次元まで縮退できるという考えのもと、パーソナリティをそれらの軸で表現することを目的とした質問紙のこと。中国からウガンダからロシアまで世界35カ国の人々がこの検査を受けており、因子の数が2つのものをモーズレー性格検査(MPI)、3つのものをアイゼンク性格検査(EPQ)と呼ぶ。
あいちゃく,愛着,Attachment,発達心理学,代理母実験,,マイヤーズ,3,233,人間と誰か、何かとの情動的なきずなを指す言葉で、特に発達心理学においては乳児が特定の誰か密接な関係を求める傾向を指す。幼い子供では、養育者の近くにいることを求め、離れると悲痛を表出するような行動で現れる強力な生存本能である。ハーロウの代理母実験により柔らかくて温かいなどの安全基地としての特徴を持つものに乳児は愛着を示すことが示されている。エインズワースのストレンジ・シチュエーションという手法により愛着は安定型愛着、不安定型愛着、無秩序型愛着などに分類されている。
あいでんてぃてぃ,アイデンティティ,identity,発達心理学,,,マイヤーズ,5,276,自分が何者であるかという一個の一貫した意識のことで、自己同一性とも呼ばれる。特にエリクソンによるとアイデンティティの形成は青年期の課題とされ、様々な役割を試し統合することによって自己の意識を確固たるものにすることが必要と言われる。自分が周囲の他者とどう異なるのかに注目することで、留学生や障害者、マイノリティ集団の一員などでは、自分たちの顕著性に基づいて社会的アイデンティティが形成されることがある。一方青年期の若者では親の価値観や期待、特定の仲間集団のアイデンティティを丸写ししてアイデンティティを早めに作ってしまう例があるとエリクソンは論じている。
あごにすと,アゴニスト,agonist,神経科学,薬物　アゴニスト,,マイヤーズ、生命科学,4,196,細胞の受容体に結合して、細胞内シグナル伝達を活性化させる物質で、生体内に存在する分子を指すリガンドに対して、生体内に存在しない物質を指す言葉。種々の受容体に対して選択性の高いアゴニストが合成されて、さまざまな疾病の治療薬として利用されている。例えば、脳内に存在するニコチン性アセチルコリン受容体は思考と密接な関係を持つが、ニコチンがアゴニストとなるため、タバコを吸うことによって集中力が増す。
あんたごにすと,アンタゴニスト,antagonist,神経科学,薬物　アンタゴニスト,,マイヤーズ、生命科学,4,243,細胞の受容体に結合して細胞内シグナル伝達を活性化させる物質であるアゴニストに対し、構造が似ているために結合するが細胞内に情報を送り込むことができない分子のこと。結果としてアゴニストの受容体への結合を遮断するために拮抗薬とも呼ばれる。種々の受容体に対して選択性の高いアゴニストが合成されて、さまざまな疾病の治療薬として利用されている。例えば、筋肉にあるニコチン性アセチルコリン受容体に対し、矢毒であるクラーレはアンタゴニストとして働き、矢に当たった動物は筋肉の収縮を止められ動かなくなる。
あすぺるがーしょうこうぐん,アスペルガー症候群,Asperger,精神医学,発達障害,,マイヤーズ、厚生労働省,5,223,自閉症スペクトラム障害（ASD）の一種で、知能が低くない高機能の自閉症の形である。知能が正常で、しばしば特定分野での非凡な技能や才能があるが、社会的スキルやコミュニケーション能力が欠如しており、どうでもいい刺激に目移りする傾向がある。近年では約100人に1人いると報告されており、性別では男性が多く、女性の約4倍の発生頻度だとされている。その原因はまだ特定されていないが、多くの遺伝的な要因が複雑に関与して起こる脳機能障害が原因と考えられている。
あせちるこりん,アセチルコリン,acetylcholine,神経科学,神経伝達物質　アンタゴニスト,,マイヤーズ,4,222,筋活動や学習、記憶に関与する興奮性の化学シナプスで用いられる神経伝達物質の一種である。特に筋活動に関しては、運動ニューロンと骨格筋のあらゆる接合部で働く神経伝達物質であり、アセチルコリンが受容体へ放出されると筋が収縮する。そのため、麻酔などにおいてはアセチルコリンに対するアンタゴニストによりアセチルコリンの伝達が阻害されることで、筋が収縮できずに運動麻痺になる。アルツハイマー病では、アセチルコリン産生ニューロンが衰退することが知られている。
あとじえばいあす,後知恵バイアス,hindsight bias,社会心理学,バイアス,,マイヤーズ,4,232,結果を知った後で、それを前から予想していたと信じる傾向のこと。「はじめからわかっていた現象」としても知られている。人間の持つ常識は、未来に何が起こるかを予測するのは難しいが過去に起こったことを説明するのに長けているという乖離があるために、現在説明できる過去の事象をその時にも予測が可能だったはずだと感じてしまうことがその理由と考えられている。また、虚記憶、公正世界信念との関連も示唆されている。起こりえた別の事象を考えることでその効果を低減させられるとされている。
あどれなりん,アドレナリン,adrenaline,神経科学,神経伝達物質,,マイヤーズ,4,195,？内分泌系で用いられるホルモンの一つ。例えば危険が迫った時に自律神経系が腎臓の直上にある副腎に指令を送りアドレナリンとノルアドレナリンを放出させ、心拍数や血圧、血糖値を上げて、エネルギー供給の急上昇をもたらし、興奮状態にさせる。ニコチンの摂取時には急増したニコチンが中枢神経系に信号を与えてアドレナリンとノルアドレナリンを放出させ、食欲の減退、注意力と心的作業効率の向上をもたらすとされる。
あぶみこつ,アブミ骨,Stapes,知覚心理学,聴覚,,マイヤーズ,1,99,中耳の骨の一つである。音波が鼓膜に伝わって固体の振動に変換されたのち、鼓膜に接するツチ骨、キヌタ骨、そしてこのアブミ骨からなる一連の力学過程が振動を蝸牛に伝える。この3つの骨を総称して耳小骨と呼ぶ。
あるこーるいそん,アルコール依存,Alcohol dependence,神経科学,薬物,,マイヤーズ、厚生労働省,4,320,アルコールを繰り返し多量に摂取した結果、アルコールに対し依存を形成し、生体の精神的および身体的機能が持続的あるいは慢性的に障害されている状態のこと。俗にアルコール中毒とも呼ばれる。アルコールは神経活動を減少させて身体機能を鈍らせる抑制薬の一種であり、神経情報処理の低下や、記憶の形成の阻害、自己認識と自己コントロールの低下をもたらす。少量摂取によって飲んだ本人は興奮状態となり活性化するが、これはアルコールが脱抑制剤として作用するためであり、判断と抑制を司る前頭前野の脳活動を鈍らせることによるものである。アルコール依存の患者では、長期の飲酒で脳が萎縮する例も見られる。特にアルコールを代謝する酵素が少ない女性の方がその危険があるとされる。
あるつはいまーびょう,アルツハイマー病,Alzheimer's disease,精神医学,,,マイヤーズ,4,324,認知症の一種で、記憶や推論能力の低下など不可逆的な様々な認知機能の低下が主な症状である。高齢化が進むにつれそのリスクが高まることが知られている。その患者では、脳細胞が失われ、記憶や思考に必要な神経伝達物質アセチルコリンを産生するニューロンが劣化することがある。アルツハイマー病の発症率は、記憶課題や運動といった心身のエクササイズを行う人で若干少ないことがわかっており、60代を過ぎて認知機能を用いる仕事や課題をこなすことがその対策として議論されるようになっている。また、新しい技術を用いてリスクの高い因子や問題のある脊髄中のタンパク質断片の発見、アルツハイマー病感受性遺伝子の検査などができるようになっており、進行を抑える薬などの研究が進んでいる。
あんふぇたみん,アンフェタミン,amphetamine,神経科学,薬物　興奮薬,,マイヤーズ、wikipedia,1,173,強い中枢興奮作用を持つ、間接型アドレナリン受容体刺激薬である。ADHDやナルコレプシーに作用するとされる薬物で、メタンフェタミンと同等の中枢興奮作用と精神依存性、薬物耐性を持つ。身体機能のスピードアップとそれに関連する活力と気分の変化をもたらす。メタンフェタミン、カフェイン、ニコチン、コカインなどに並ぶ興奮薬で、日本では覚醒剤に指定されている。
あへんざい,アヘン剤,opiate,神経科学,,,マイヤーズ,2,255,アヘンとその誘導体であるモルヒネやヘロインのこと。神経の正常な機能を抑制し、一時的に疼痛や不安を軽減する効果がある。摂取した際には瞳孔は収縮し、呼吸は遅くなり、眠気が襲ってきて、短期間の快楽が得られる。その短期間の快楽の代償として、アヘン剤使用者は次の摂取への渇望やだんだんと増える増加量、極めて不快な離脱症状に悩まされることになる。人工アヘン剤の長期の使用で、脳は天然の麻薬物質であるエンドルフィンを生成しなくなり、その後にアヘン剤を離脱した場合、鎮痛作用を司る神経伝達物質が低いレベルの状態になるとされる。
あるふぁは,アルファ波,alpha wave,脳神経科学,,,マイヤーズ、心理生理学,4,278,律動性の脳波の成分のうち、リラックスした覚醒状態で特に顕著に現れる比較的遅めの8Hzから13Hzの脳波のこと。人の脳波を初めて報告したドイツの精神科医ハンス・ベルガーによって名付けられた。特に入眠直前の安静時の脳波で最も綺麗に現れるとされており、深く眠るにつれその周波数が低下し、振幅が大きくなることが報告されている。心理学研究においてはリラックスの指標として用いられており、開眼、刺激の提示、課題の開始などによってアルファ波が消えることが知られている。また、脳機能研究においてもアルファ波のパワーが脳部位の活動性の低さに対応していることが用いられている。
あんていてん,安定点,settling point,健康心理学,設定点　飢餓,,マイヤーズ、厚生労働省,1,265,ある人の体重がカロリーの摂取・消費（環境要因と生物学的要因に影響されるもの）に応じて収まっていく体重レベルのことを指す。例えば1日の摂取エネルギーを100kcal減らした場合、ある程度の期間は体重が減少するが、体重が徐々に減ることによって1日の消費エネルギーも少しずつ減少するために体重の変化は緩慢になり、やがて変化しなくなる。この摂取と消費の関係から定まるのが安定点であり、生物の特定の体重レベルを維持しようとする働きにおいて体重が元に戻ろうとする基準となる体重である設定点（setting point）とは区別して用いられる。
いかり,怒り,,,,,,3,0,
いきか,閾下,,,,,,4,0,
いきち,閾値,,,,,,3,0,
いしき,意識,,,,,,2,0,
いしきたいけん,意識体験,,,,,,2,0,
いじんしゅこうか,異人種間効果,,,,,,4,0,
いせいあいしこう,異性愛指向,,,,,,3,0,
いそん,依存,,,,,,4,0,
いちごはつわだんかい,一語発話段階,,,,,,2,0,
いちじきょうかし,一次強化子,,,,,,2,0,
いちらんせいそうせいじ,一卵性双生児,,,,,,2,0,
いっしゅつこうか,溢出効果,,,,,,,0,
いっぱんちのう,一般知能(g),,,,,,,0,
いでんし,遺伝子,,,,,,,0,
いでんてきしんぞく,遺伝的親族,,,,,,,0,
いでんりつ,遺伝率,,,,,,,0,
いど,イド,,,,,,,0,
いにしあちぶ,イニシアチブ,,,,,,,0,
いみろん,意味論,,,,,,,0,
いみんのぱらどっくす,移民のパラドックス,,,,,,,0,
いめーじぼうちょう,イメージ膨張,,,,,,,0,
いろのこうじょうせい,色の恒常性,,,,,,,0,
いんえい,陰影,,,,,,,0,
いんしぶんせき,因子分析,,,,,,,0,
いんすりん,インスリン,,,,,,,0,
いんせいしょうじょう,陰性症状,,,,,,,0,
いんふぉーむどこんせんと,インフォームドコンセント,,,,,,,0,
いんぽてんす,インポテンス,,,,,,,0,
うぇくすらーちのうけんさ,ウェクスラー知能検査,,,,,,,0,
うぇーばーのほうそく,ウェーバーの法則,,,,,,,0,
うぇるにっけや,ウェルニッケ野,,,,,,,0,
うじとそだちもんだい,氏と育ち問題,,,,,,,0,
うそはっけんき,うそ発見機,,,,,,,0,
うつびょう,うつ病,,,,,,,0,
うまみ,うま味,,,,,,,0,
うんどうかく,運動覚,,,,,,,0,
うんどうにゅーろん,運動ニューロン,,,,,,,0,
うんどうや,運動野,,,,,,,0,
れんぞくせいのかてい,連続性の仮定,,,,,,,0,
ちゅういせいぎょりろん,注意制御理論（ACT）,Attention Control Theory,,,,,,0,
ふおうき,不応期,refractory period,神経科学,活動電位　静止膜電位,,カンデル神経科学,4,160,活動電位が発生した後に電位依存性チャネルが不活性化する、つまり電位によって開かない状態となること。これにより活動電位の逆流が起こらず、活動電位が軸索を伝わる方向が細胞体から軸索終末方向に限定されている。活動電位の後に電位依存性カリウムチャネルが開き続けることによる一過性の後過分極における膜のカリウムコンダクタンスの増加
,皮膚コンダクタンス,,,,,,,,